{
  "version": 1,
  "generated_at": "2026-07-28T00:00:00+00:00",
  "provider": "tmdb",
  "language": "en-US",
  "image_config": {
    "secure_base_url": "https://image.tmdb.org/t/p/",
    "poster_size": "w500",
    "backdrop_size": "w780"
  },
  "films": [
    {
      "film_id": "tmdb:15080",
      "tmdb_id": 15080,
      "imdb_id": "tt0094625",
      "original_title": "おもひでぽろぽろ",
      "display_title": "Only Yesterday",
      "original_language": "ja",
      "release_date": "1991-07-20",
      "release_year": 1991,
      "overview": "In lyrical switches between the present and the past, Taeko contemplates the arc of her life.",
      "genres": [
        { "id": 16, "name": "Animation" },
        { "id": 18, "name": "Drama" }
      ],
      "directors": [
        { "tmdb_person_id": 608, "name": "Isao Takahata" }
      ],
      "top_cast": [
        {
          "tmdb_person_id": 1,
          "name": "Miki Imai",
          "character": "Taeko Okajima",
          "order": 0
        }
      ],
      "poster": {
        "path": "/tOSnFE9e82iH3ZAzSTtuOkBsabJ.jpg",
        "url": null
      },
      "backdrop": {
        "path": "/example_backdrop.jpg",
        "url": null
      },
      "runtime_minutes": 118,
      "us_certification": "G",
      "provenance": {
        "provider": "tmdb",
        "fetched_at": "2026-07-28T00:00:00+00:00",
        "language": "en-US",
        "append_to_response": ["credits", "external_ids", "release_dates"]
      },
      "field_provenance": {
        "canonical_title": "tmdb",
        "release_date": "tmdb",
        "release_year": "tmdb",
        "runtime_minutes": "tmdb",
        "us_certification": "tmdb",
        "genres": "tmdb",
        "overview": "tmdb",
        "poster": "tmdb",
        "backdrop": "tmdb",
        "director": "tmdb"
      }
    }
  ]
}
